{
  "schema_version": "0.4.0",
  "id": "77777777-7777-4777-8777-777777777777",
  "project_id": "11111111-1111-4111-8111-111111111111",
  "created_at": "2026-08-18T02:40:00Z",
  "created_by": "主编",
  "scene_id": "33333333-3333-4333-8333-333333333333",
  "candidate_change_ids": [
    "88888888-8888-4888-8888-888888888888"
  ],
  "outcome": "RuleFailed",
  "violations": [
    {
      "rule_id": "world-rule-can-activate-jade",
      "severity": "Blocking",
      "entity_ids": [
        "路人",
        "残玉"
      ],
      "source_evidence": "残玉在路人手中也亮了",
      "canon_evidence": "残玉只能由林晚触活",
      "recommended_action": "Regenerate"
    }
  ]
}
